<?xml version='1.0' encoding='utf-8' standalone='no'?>
<!DOCTYPE issue SYSTEM "lwg-issue.dtd">

<issue num="2812" status="C++17">
<title>Range access is available with <tt>&lt;string_view&gt;</tt></title>
<section><sref ref="[iterator.range]"/><sref ref="[string.view.synop]"/></section>
<submitter>Johel Ernesto Guerrero Pe&ntilde;a</submitter>
<date>29 Oct 2016</date>
<priority>0</priority>

<discussion>
<p>
<sref ref="[string.view.synop]"/>/1 states
</p>
<blockquote><p>
The function templates defined in 20.2.2 and 24.7 are available when <tt>&lt;string_view&gt;</tt> is included.
</p></blockquote>
<p>
<sref ref="[iterator.range]"/>, in p1 is missing <tt>&lt;string_view&gt;</tt>.
</p>

<note>Issues Telecon 16-Dec-2016</note>
<p>Move to Tentatively Ready</p>
</discussion>

<resolution>
<p>This wording is relative to N4606.</p>

<ol>
<li>
<p>Edit <sref ref="[iterator.range]"/> p1 as indicated:</p>

<blockquote>
<p>
-1- In addition to being available via inclusion of the <tt>&lt;iterator&gt;</tt> header, the function templates 
in 24.7 are available when any of the following headers are included: <tt>&lt;array&gt;</tt>, <tt>&lt;deque&gt;</tt>, 
<tt>&lt;forward_list&gt;</tt>, <tt>&lt;list&gt;</tt>, <tt>&lt;map&gt;</tt>, <tt>&lt;regex&gt;</tt>, 
<tt>&lt;set&gt;</tt>, <tt>&lt;string&gt;</tt><ins>, <tt>&lt;string_view&gt;</tt></ins>, <tt>&lt;unordered_map&gt;</tt>, 
<tt>&lt;unordered_set&gt;</tt>, and <tt>&lt;vector&gt;</tt>.
</p>
</blockquote>
</li>
</ol>

</resolution>

</issue>
