<?xml version='1.0' encoding='utf-8' standalone='no'?>
<!DOCTYPE issue SYSTEM "lwg-issue.dtd">

<issue num="2804" status="Pending WP">
<title>Unconditional <tt>constexpr</tt> default constructor for <tt>istream_iterator</tt></title>
<section><sref ref="[istream.iterator.cons]"/></section>
<submitter>United States</submitter>
<date>9 Nov 2016</date>
<priority>0</priority>

<discussion>
<p>
<b>Addresses US 152</b>
<p/>
<i>see below</i> for the default constructor should simply be 
spelled <tt>constexpr</tt>. The current declaration looks like a 
member function, not a constructor, and the <tt>constexpr</tt> 
keyword implicitly does not apply unless the instantiation could 
make it so, under the guarantees al ready present in the Effects clause.
</p>
<p>
Proposed change:
<p/>
Replace <i>see below</i> with <tt>constexpr</tt> in the declaration 
of the default constructor for <tt>istream_iterator</tt> in the 
class definition, and function specification.
</p>

<note>Issues Telecon 16-Dec-2016</note>
<p>Jonathan provides wording, Move to Tentatively Ready</p>
</discussion>

<resolution>
<p>In the class synopsis in 24.6.1 [istream.iterator] change the default constructor:</p>
<blockquote>
<pre>
<del><i>see below</i></del><ins>constexpr</ins> istream_iterator();
istream_iterator(istream_type&amp; s);
istream_iterator(const istream_iterator&amp; x) = default;
~istream_iterator() = default;
</pre>
</blockquote>

<p>Change [istream.iterator.cons] before paragraph 1:</p>
<blockquote>
<pre>
<del><i>see below</i></del><ins>constexpr</ins> istream_iterator();

-1- Effects: ...
</pre>
</blockquote>
</resolution>

</issue>
