<?xml version='1.0' encoding='UTF-8' standalone='no'?>
<!DOCTYPE issue SYSTEM "lwg-issue.dtd">

<issue num="2482" status="C++17">
<title>&sect;[c.strings] Table 73 mentions nonexistent functions</title>
<section><sref ref="[c.strings]"/></section>
<submitter>S. B.Tam</submitter>
<date>18 Jan 2015</date>
<priority>99</priority>

<discussion>
<p>
N4296 Table 73 mentions the functions <tt>mbsrtowc</tt> and <tt>wcsrtomb</tt>, which are not defined in ISO C 
or ISO C++. Presumably they should be <tt>mbsrtowcs</tt> and <tt>wcsrtombs</tt> instead. 
</p>

<note>2015-04-02 Library reflector vote</note>
<p>
The issue has been identified as Tentatively Ready based on six votes in favour.
</p>
</discussion>

<resolution>

<p>This wording is relative to N4296.</p>

<ol>
<li>
<blockquote>
<table border="1" cellpadding="4" rules="groups" style="table-layout:fixed">
<caption>Table 33 &mdash; Potential <tt>mbstate_t</tt> data races</caption>
<tr>
<td>
<tt>mbrlen</tt>
</td>
<td>
<tt>mbrtowc</tt>
</td>
<td>
<tt>mbsrtowc<ins>s</ins></tt>
</td>
<td>
<tt>mbtowc</tt>
</td>
<td>
<tt>wcrtomb</tt>
</td>
</tr>

<tr>
<td>
<tt>wcsrtomb<ins>s</ins></tt>
</td>
<td>
<tt>wctomb</tt>
</td>
</tr>

</table>
</blockquote>
</li>
</ol>

</resolution>

</issue>
