<?xml version='1.0' encoding='utf-8' standalone='no'?>
<!DOCTYPE issue SYSTEM "lwg-issue.dtd">

<issue num="2679" status="C++17">
<title>Inconsistent Use of Effects and Equivalent To</title>
<section><sref ref="[structure.specifications]"/></section>
<submitter>Dawn Perchik</submitter>
<date>14 Apr 2016</date>
<priority>3</priority>

<discussion>
<ul>
<li><p>
Some <i>Effects</i>: were intended to include the "Equivalent to" phrasing where no or different words were used.  
See examples in <tt>std::filesystem</tt> and throughout the library.
</p></li>
<li><p>
The wording in [structure.specifications]/4 is incorrect and <i>Effects</i>: throughout the library which use 
(or were intended to use) the "Equivalent to" phrasing need to be checked to make sure they fit the intended wording.
</p></li>
</ul>

<note>2016-04, Issues Telecon</note>
<p>
The PR is fine; but bullet #1 in the report really should have a list of places to change.
<p/>
Jonathan checked throughout the library for bullet #2 and found two problems in [string.access], 
which have been added to the PR.
</p>

<note>2016-08-03 Chicago</note>
<p>Fri PM: Move to Tentatively Ready</p>
</discussion>

<resolution>
<ol>
<li>
<p>Change [structure.specifications]/4 as indicated:</p>

<blockquote>
<p>
"[&hellip;] if <tt>F</tt> has no <i>Returns</i>: element, a non-<tt>void</tt> return from <tt>F</tt> is specified by the 
<del>Returns: elements</del><ins>return statements</ins> in the code sequence."
</p>
</blockquote>
</li>

<li><p>Add two <tt>return</tt> keywords to [string.access]:</p>

<blockquote>
<pre>
const charT&amp; front() const;
charT&amp; front();
</pre>
<blockquote>
<p>-7- <i>Requires:</i> <code>!empty()</code>.</p>
<p>-8- <i>Effects:</i> Equivalent to <code><ins>return </ins>operator[](0)</code>.</p>
</blockquote>

<pre>
const charT&amp; back() const;
charT&amp; back();
</pre>
<blockquote>
<p>-9- <i>Requires:</i> <code>!empty()</code>.</p>
<p>-10- <i>Effects:</i> Equivalent to <code><ins>return </ins>operator[](size() - 1)</code>.</p>
</blockquote>
</blockquote>
</li>
</ol>
</resolution>

</issue>


