<?xml version='1.0' encoding='utf-8' standalone='no'?>
<!DOCTYPE issue SYSTEM "lwg-issue.dtd">

<issue num="3708" status="C++23">
<title><tt>take_while_view::<i>sentinel</i></tt>'s conversion constructor should move</title>
<section><sref ref="[range.take.while.sentinel]"/></section>
<submitter>Hewill Kang</submitter>
<date>03 Jun 2022</date>
<priority>99</priority>

<discussion>
<p>
The conversion constructor of <tt>take_while_view::<i>sentinel</i></tt> requires 
<tt>sentinel_t&lt;V&gt;</tt> must satisfy <tt>convertible_to&lt;sentinel_t&lt;<i>Base</i>&gt;&gt;</tt>, 
which indicates that the rvalue reference of <tt>sentinel_t&lt;V&gt;</tt> can be converted to 
<tt>sentinel_t&lt;<i>Base</i>&gt;</tt>, but in the <i>Effects</i> element, we assign the lvalue 
<tt>s.<i>end_</i></tt> to <tt><i>end_</i></tt>.
</p>

<note>2022-06-21; Reflector poll</note>
<p>
Set status to Tentatively Ready after seven votes in favour during reflector poll.
</p>

<note>2022-07-15; LWG telecon: move to Ready</note>

<note>2022-07-25 Approved at July 2022 virtual plenary. Status changed: Ready &rarr; WP.</note>
</discussion>

<resolution>
<p>
This wording is relative to <paper num="N4910"/>.
</p>

<ol>
<li><p>Modify <sref ref="[range.take.while.sentinel]"/> as indicated:</p>

<blockquote>
<pre>
constexpr <i>sentinel</i>(<i>sentinel</i>&lt;!Const&gt; s)
  requires Const &amp;&amp; convertible_to&lt;sentinel_t&lt;V&gt;, sentinel_t&lt;<i>Base</i>&gt;&gt;;
</pre>
<blockquote>
<p>
-2- <i>Effects:</i> Initializes <tt><i>end_</i></tt> with <tt><ins>std::move(</ins>s.<i>end_</i><ins>)</ins></tt> and <tt>pred_</tt> with <tt>s.<i>pred_</i></tt>.
</p>
</blockquote>
</blockquote>
</li>

</ol>
</resolution>

</issue>
